URL_NUM,URL_NAME,NLP_READING_TIME_IN_MINS_212WPM,BSOUP_NUMWORDS,NLP_NUMWORDS,META_YEARS_SINCE_FIRST_PUBLISHED,META_YEARS_SINCE_LAST_MODIFIED,NLP_FIRST_PUBLISHED_DATETIME,META_FIRST_PUBLISHED_DATE,META_LAST_MODIFIED_DATETIME,NLP_KEYWORDS,TITLE_TAG_VALUE,META_DESCRIPTION
url462,https://www.indianhealthyrecipes.com/idli-upma-recipe/,3.0,676,634,3.301,0.279,2016-08-15T08:48:15,2016-08-15T08:48:15,2019-08-23T07:20:07,upma - add - idlis - idli - recipe - tsp - onions - leaves - turn - turmeric,Idli upma recipe - Swasthi's Recipes,Idli upma recipe - One of the easiest ways to use leftover idlis. Sharing my mum's idli upma recipe that can be made just under 10 mins.
url463,https://www.indianhealthyrecipes.com/iftar-recipes-ramadan-recipes/,2.9,3078,619,3.773,0.537,2016-02-25T16:01:53,2016-02-25T16:01:53,2019-05-21T23:22:19,ramadan - healthy - fast - snacks - foods - sweets - iftar - fried - recipes - month,Iftar recipes | Ramadan recipes for Iftar | Iftar snacks sweets recipes,"Iftar recipes or Ramdan recipes - Iftar snacks recipes - Veg, non-veg snacks, sweets, beverages to enjoy during the fasting days of ramadan."
url464,https://www.indianhealthyrecipes.com/iftar-sweets-recipes/,0.4,1212,75,2.521,0.499,2017-05-27T18:21:23,2017-05-27T18:21:23,2019-06-04T02:09:26,cooking - help - food - ramadan - timetested - sweet - dessert - sweets - swasthis - dishes - swasthi - cook - iftar - recipes - writer - indian,Iftar sweets recipes | Ramadan dessert recipes | Sweet dishes for iftar,No meta description found.
url465,https://www.indianhealthyrecipes.com/indian-baby-food-chart/,3.4,1469,724,5.085,0.34,2014-11-03T07:00:40,2014-11-03T07:00:40,2019-08-01T06:48:17,chart - food - toddlers - weight - based - babies - post - gain - baby - months - recipes - indian,Baby food chart with recipes for 7 months to 1 year Indian baby & toddlers,Baby food chart along with tried & tested recipes for 7 months to 1 year Indian baby & toddlers. Tips to improve appetite for healthy growth of the baby
url466,https://www.indianhealthyrecipes.com/indian-baby-food-recipe/,4.8,1029,1026,6.989,0.345,2012-12-08T18:26:00,2012-12-08T18:26:00,2019-07-30T01:13:14,food - 18 - add - apple - homemade - water - puree - baby - months - recipes - tbsp - indian - rice,Baby food recipes - 6 to 18 months | Homemade Indian baby food recipes,Baby food recipes - a collection of very good healthy homemade Indian baby food recipes with practical tips for easy weaning.
url467,https://www.indianhealthyrecipes.com/indian-chicken-curry-recipes/,3.5,767,740,3.293,0.071,2016-08-18T05:16:04,2016-08-18T05:16:04,2019-11-07T02:48:48,curry - masala - 12 - naan - gravy - recipe - plain - dish - chicken - roti - recipes - indian - rice,"Chicken gravy recipes | How to make chicken gravy for rice, roti, naan",Chicken gravy recipes - A collection of mouth watering & best chicken gravy recipes from North Indian & South Indian cuisines to try.
url468,https://www.indianhealthyrecipes.com/indian-recipes-bachelors/,7.7,1617,1622,0.2,0.066,2019-09-21T13:33:35,2019-09-21T13:33:35,2019-11-09T06:40:51,paneer - food - bachelors - masala - beginners - style - check - recipe - dish - dishes - dinner - recipes - indian - rice,Indian dinner recipes | Indian food recipes for bachelors & beginners,"Indian dinner recipes or Indian food recipes for bachelors, beginners and working women. Recipes with step by step pictures and videos."
url469,https://www.indianhealthyrecipes.com/indo-chinese-veg-fried-rice-recipe/,3.4,756,711,7.049,0.501,2012-11-16T07:49:00,2012-11-16T07:49:00,2019-06-03T00:02:13,veg - garlic - add - saute - recipe - red - g - chilli - fried - veggies - rice,"chilli garlic fried rice, how to make chilli garlic veg fried rice","chilli garlic veg fried rice - aromatic, hot, spicy and delicious rice made in Indo chinese style. It has mild flavours of garlic and heat from red chilies"
url470,https://www.indianhealthyrecipes.com/instant-pesarattu-moong-dal-dosa-recipe/,4.8,1050,1027,5.548,0.288,2014-05-18T12:42:00,2014-05-18T12:42:00,2019-08-20T09:10:58,oil - dal - batter - ginger - water - moong - dosa - green - g - onions,Moong dal dosa | How to make moong dal dosa | Instant pesarattu,"Moong dal dosa recipe with step by step photos. Crispy, tasty, cone shaped dosa made using moong dal . One of our favorite healthy breakfasts for the kids"
url471,https://www.indianhealthyrecipes.com/instant-pot-brown-rice/,6.6,1414,1394,0.564,0.227,2019-05-11T09:21:53,2019-05-11T09:21:53,2019-09-11T03:36:23,method - brown - cup - inner - pressure - water - pot - instant - cook - rice,Instant pot brown rice | How to cook brown rice in Instant pot,"Instant pot brown rice recipe - Learn to make fluffy & perfect instant pot brown rice every time. Serve it with any curry, dal or use it to make fried rice"
url472,https://www.indianhealthyrecipes.com/instant-pot-dal/,6.9,1468,1456,0.033,0.027,2019-11-21T14:54:11,2019-11-21T14:54:11,2019-11-23T14:46:00,cup - add - dal - bowl - pressure - water - pot - instant - cook - rice,Instant pot dal & rice recipe - Swasthi's Recipes,Instant pot dal & rice - Learn to cook dal & rice together in instant pot following this super easy pot-in-pot method with video & step by step photos.
url473,https://www.indianhealthyrecipes.com/instant-pot-quinoa/,3.8,839,800,0.501,0.227,2019-06-03T09:42:13,2019-06-03T09:42:13,2019-09-11T04:08:05,cup - add - pressure - pour - water - quinoa - pot - instant - cook - step,Instant Pot Quinoa | How to cook quinoa in instant pot - Swasthi's Recipes,"Instant pot quinoa - Step by step guide to cook perfect quinoa in instant pot. Serve quinoa with curries, dal or use on salads."
url474,https://www.indianhealthyrecipes.com/instant-pot-rice-pudding/,4.0,889,856,0.816,0.337,2019-02-08T14:33:37,2019-02-08T14:33:37,2019-08-02T15:41:11,set - add - sugar - pot - instant - pudding - g - coconut - milk - rice,Instant pot rice pudding recipe | Creamy rice pudding in Instant pot,"Instant pot rice pudding - so delicious, creamy, thick & flavorful pudding in just 2 steps. Dump the ingredients & set instant pot."
url475,https://www.indianhealthyrecipes.com/jackfruit-seeds-kurma-curry-recipe/,3.7,816,794,5.315,0.279,2014-08-11T09:42:46,2014-08-11T09:42:46,2019-08-23T07:39:02,curry - jackfruit - add - seeds - recipe - jack - seed - fruit - roasted - kurma - till - paste,jackfruit seeds kurma curry - Swasthi's Recipes,No meta description found.
url476,https://www.indianhealthyrecipes.com/jaggery-syrup-jaggery-recipes/,3.6,784,765,3.37,0.236,2016-07-21T13:57:45,2016-07-21T13:57:45,2019-09-08T05:53:28,iron - store - jaggery - recipe - sugar - dark - used - using - months - thick - syrup,Jaggery syrup | How to make Jaggery syrup - Swasthi's Recipes,No meta description found.
url477,https://www.indianhealthyrecipes.com/jalebi-recipe/,8.8,1860,1869,1.09,0.189,2018-10-31T12:38:21,2018-10-31T12:38:21,2019-09-25T06:08:50,oil - add - jalebi - batter - recipe - water - sugar - hot - consistency - thick - syrup,Jalebi recipe | How to make jalebi - Swasthi's Recipes,Jalebi recipe - Crispy & juicy jalebi recipe with step by step photos. One of the most easiest & delicious sweet you can make this Diwali.
url478,https://www.indianhealthyrecipes.com/jeera-aloo-recipe/,6.2,1329,1309,1.595,0.397,2018-04-30T15:07:01,2018-04-30T15:07:01,2019-07-11T03:10:37,add - cumin - powder - recipe - tbsp - tsp - potatoes - aloo - rice - jeera,Jeera aloo recipe | How to make jeera aloo - Swasthi's Recipes,"Jeera aloo is a simple delicious made with potatoes, spices and cumin as the main ingredients. Very basic spice powders are used to flavor it."
url479,https://www.indianhealthyrecipes.com/jeera-rice-recipe/,11.9,2506,2518,0.773,0.068,2019-02-24T04:56:07,2019-02-24T04:56:07,2019-11-08T16:16:42,add - pressure - saute - recipe - water - pulao - pot - spices - cook - rice - jeera,Jeera rice recipe (Stovetop & Instant pot) - Swasthi's Recipes,"Jeera rice recipe - Learn how to make jeera rice in 2 ways. Restaurant style & homestyle - both yield delicious, grainy & flavorful cumin rice."
url480,https://www.indianhealthyrecipes.com/jhal-muri-recipe/,3.8,839,806,1.603,0.279,2018-04-27T08:04:16,2018-04-27T08:04:16,2019-08-23T07:17:39,muri - cup - add - powder - coriander - recipe - used - g - puffed - jhal - rice,Jhal muri recipe | How to make Jhal muri | Spicy puffed rice chaat,"Jhal muri is a quick spicy puffed rice snack popular in kolkata. Chopped vegetables, various spice powders, puffed rice & roasted peanuts"
url481,https://www.indianhealthyrecipes.com/jowar-dosa-jonna-dosa-recipe/,3.4,776,721,4.277,0.529,2015-08-25T07:04:17,2015-08-25T07:04:17,2019-05-24T05:42:19,cup - jowar - hours - urad - dal - jonna - dose - jolada - batter - recipe - water - dosa - recipes - needed,Jowar dosa | Jonna dosa recipe | Jolada dose | Jowar recipes,"Jowar also known as sorghum in english are gluten free whole grain. This jowar dosa is healthy, wholesome, delicious and simple to make."
url482,https://www.indianhealthyrecipes.com/jowar-pops-jowar-puffs-recipe/,4.1,925,879,3.03,0.504,2016-11-22T05:11:34,2016-11-22T05:11:34,2019-06-02T00:49:06,jowar - good - add - dry - jonna - allow - pelalu - recipe - flame - spiced - puffs - pops,Jowar pops recipe | Spiced jowar puffs recipe | Jonna pelalu recipe,No meta description found.
url483,https://www.indianhealthyrecipes.com/jowar-upma-jonna-upma-jowar-recipes/,4.1,914,875,4.008,0.523,2015-12-01T01:07:29,2015-12-01T01:07:29,2019-05-26T04:37:01,upma - jowar - cup - add - hours - pressure - jonna - saute - recipe - water - g - recipes,Jowar upma recipe | Jonna upma | Jowar recipes,"Jowar upma recipe. Also known as jonna, jola or jowari in other regional Indian languages. This upma tastes delicious is healthy and nutritious."
url484,https://www.indianhealthyrecipes.com/junnu-kharvas-recipe/,3.6,824,762,4.992,0.159,2014-12-07T04:10:15,2014-12-07T04:10:15,2019-10-06T09:29:24,steamer - kharvas - powder - junnu - mg - colostrum - water - pudding - milk - pepper,Junnu or kharvas recipe | How to make junnu or kharvas,"junnu, kharvas, ginnu is a steamed milk pudding made of cow's colostrum milk. junnu or kharvas is higly nutritious and increases immunity. yummy delicious"
url485,https://www.indianhealthyrecipes.com/kadai-chicken/,7.0,1491,1482,6.896,0.37,2013-01-11T18:36:00,2013-01-11T18:36:00,2019-07-21T06:54:17,cup - add - masala - seeds - kadai - recipe - red - teaspoon - karahi - chicken - cook - onions,Kadai chicken recipe | Chicken karahi - Swasthi's Recipes,Kadai chicken recipe - Also called as chicken karahi - Learn to make the best delicious kadai chicken recipe with step by step pictures
url486,https://www.indianhealthyrecipes.com/kadai-egg-masala-egg-capsicum-curry/,4.5,987,951,3.422,0.537,2016-07-02T08:54:58,2016-07-02T08:54:58,2019-05-21T07:18:03,curry - cup - set - add - masala - powder - egg - saute - kadai - recipe - onions - capsicum,Kadai egg masala recipe | Egg capsicum curry recipe,No meta description found.
url487,https://www.indianhealthyrecipes.com/kadai-mushroom-gravy-recipe/,6.7,1420,1410,2.09,0.192,2017-10-31T13:49:11,2017-10-31T13:49:11,2019-09-24T04:36:32,tomatoes - mushroom - add - masala - powder - coriander - mushrooms - saute - kadai - recipe,Kadai mushroom recipe | How to make kadai mushroom,"Kadai mushroom gravy recipe made button mushrooms - North Indian, spicy, hot and delicious restaurant style gravy. It can be served with rice, roti, phulka."
url488,https://www.indianhealthyrecipes.com/kadai-paneer-gravy-recipe/,9.2,1933,1950,3.721,0.068,2016-03-15T14:02:13,2016-03-15T14:02:13,2019-11-08T02:51:35,cup - paneer - add - masala - seeds - saute - gravy - recipe - kadai - red,Kadai paneer recipe | How to make kadai paneer gravy - Swasthi's Recipes,"Kadai paneer is a delicious, flavorful & spicy dish made with paneer, kadai masala & herbs. Serve it with rice, roti or naan."
url489,https://www.indianhealthyrecipes.com/kaju-katli-kaju-barfi/,8.7,1860,1839,5.134,0.2,2014-10-16T15:37:21,2014-10-16T15:37:21,2019-09-21T07:54:23,kaju - add - powder - cashews - barfi - recipe - katli - sugar - water - mixture - cashew,Kaju katli recipe | How to make kaju katli - Swasthi's Recipes,Kaju katli is a smooth thin fudge made of cashews & sugar. Learn how to make the best kaju katli at home with video & step by step pics.
url490,https://www.indianhealthyrecipes.com/kakarakaya-fry-recipe-bitter-gourd-fry/,5.3,1160,1129,3.167,0.551,2016-10-03T02:55:21,2016-10-03T02:55:21,2019-05-16T16:31:46,stir - tamarind - add - jaggery - gourd - powder - karela - recipe - bitter - fry - kakarakaya - rice,Kakarakaya fry | Bitter gourd fry | Karela fry - Swasthi's Recipes,"Kakarakaya fry recipe video or bitter gourd stir fry recipe - Simple, healthy & delicious tasting bitter gourd fry that goes good to serve with rice, rasam"
url491,https://www.indianhealthyrecipes.com/kambu-dosai-recipe/,4.7,1042,989,2.118,0.529,2017-10-21T14:44:58,2017-10-21T14:44:58,2019-05-24T08:23:31,add - kambu - urad - dal - batter - recipe - millet - water - dosa - bajra - recipes - sajjala - dosai - rice - pearl,Kambu dosai recipe | Bajra dosa recipe | Sajjala dosa | Pearl millet recipes,"Kambu dosai or bajra dosa, sajjala dosa is a thin crepe made with pearl millet. These are healthy and Delicious and make a good breakfast with chutney"
url492,https://www.indianhealthyrecipes.com/kanda-gadda-mulakkaya-pulusu-yam-and-drumstick-stew-recipe/,3.0,700,645,5.247,0.586,2014-09-05T00:31:00,2014-09-05T00:31:00,2019-05-03T03:50:03,curry - kanda - mg - gadda - water - tsp - cook - yam - pulusu - rice,Kanda gadda pulusu | Yam curry - Swasthi's Recipes,"Kanda gadda pulusu or yam curry is a sweet, sour and spicy andhra style stew made with yam. Serve it with rice or chapati."
url493,https://www.indianhealthyrecipes.com/kandagadda-vepudu-recipe-elephant-yam-roast-south-indian-yam-fry/,3.5,780,734,5.06,0.515,2014-11-12T02:07:00,2014-11-12T02:07:00,2019-05-29T04:23:12,stir - recipe - pepper - fry - tsp - water - vepudu - yam - skin - leaves - kandagadda - pieces,Yam fry recipe | Suran fry recipe (kandagadda vepudu recipe),Yam fry recipe or suran fry - easy tips to clean yam without itch on the hands. Learn how to make yam stir fry to go wtih rice
url494,https://www.indianhealthyrecipes.com/kandi-pachadi/,3.4,761,719,7.392,0.573,2012-07-14T10:30:00,2012-07-14T10:30:00,2019-05-08T04:03:46,kandi - garlic - chilies - add - dal - recipe - red - teaspoon - chutney - pachadi - toor,Kandi pachadi | Toor dal chutney recipe - Swasthi's Recipes,"kandi pachadi is a traditional andhra style chutney made with toor dal, red chilies, cumin & garlic. It is eaten with rice or breakfasts & snacks."
url495,https://www.indianhealthyrecipes.com/karanji-recipe-video-kajjikayalu-recipe/,4.9,1069,1032,3.107,0.159,2016-10-25T02:54:15,2016-10-25T02:54:15,2019-10-06T09:00:55,video - oil - add - dough - heat - kajjikayalu - recipe - fry - sugar - karanji - used - ghee - coconut,Karanji recipe video | Kajjikayalu recipe | How to make easy karanji recipe,"Karanji recipe with video. Kajjikayalu, Nevri, karanji, karjikai are the different names to this deep fried snack made during festivals mostly during diwali"
url496,https://www.indianhealthyrecipes.com/karasev-recipe/,5.3,1154,1121,2.151,0.121,2017-10-09T05:35:19,2017-10-09T05:35:19,2019-10-20T07:52:50,oil - add - karasev - dough - diwali - sev - snacks - murukku - recipe - tbsps - flour - recipes - hot - besan,Karasev recipe | Besan sev recipe | Diwali snacks recipes,Karasev recipe - Karasev are also known as besan sev. These are made with gram flour and are quick to make snack furing festivals
url497,https://www.indianhealthyrecipes.com/karivepaku-podi-curry-leaves-powder-rice/,5.3,1169,1131,3.879,0.537,2016-01-17T00:27:55,2016-01-17T00:27:55,2019-05-21T08:35:04,curry - karivepaku - oil - chilies - add - powder - red - podi - coconut - leaves - rice,Karivepaku podi | Curry leaves powder recipe | Curry leaves rice,"Karivepaku podi - spiced curry leaves powder recipe, how to make quick curry leaves powder rice. Healthy, delicious and iron rich."
url498,https://www.indianhealthyrecipes.com/kashmiri-veg-pulao-restaurant-style/,3.9,852,837,7.052,0.277,2012-11-15T15:35:00,2012-11-15T15:35:00,2019-08-24T09:50:45,rose - add - fruits - dry - kashmiri - water - pulao - spices - fry - milk - till - rice,Kashmiri pulao recipe | How to make kashmiri pulao - Swasthi's Recipes,"kashmiri pulao recipe with step by step photos. It is a very easy simple pulao garnished with nuts, raisins and fresh fruits like pomegranate, apple"
url499,https://www.indianhealthyrecipes.com/kathi-rolls-recipe-make-kati-rolls/,6.7,1443,1419,3.337,0.373,2016-08-02T12:06:41,2016-08-02T12:06:41,2019-07-20T05:19:55,veg - oil - add - recipe - kati - roll - teaspoon - kathi - roti - chutney - rolls - green - kids,Kathi roll recipe | How to make veg kati roll | Kids Recipes,Kathi roll is a delicious Indian style wrap stuffed with spiced mix veggies. Learn to make the best veg kati rolls at home with this recipe
url500,https://www.indianhealthyrecipes.com/keema-recipe-mutton-keema-curry/,4.9,1052,1044,2.479,0.115,2017-06-11T16:15:54,2017-06-11T16:15:54,2019-10-22T11:51:38,curry - keema - add - masala - powder - mutton - mins - recipe - g - cook - onions,Keema recipe | Mutton keema curry recipe - Swasthi's Recipes,"Keema recipe with video & step by step photos. This mutton keema is simple to make and tastes delicious to serve with naan, roti or rice"
url501,https://www.indianhealthyrecipes.com/khara-bath/,4.6,1006,983,0.805,0.066,2019-02-12T14:43:11,2019-02-12T14:43:11,2019-11-09T07:22:51,spice - add - masala - rava - powder - bath - water - tsp - khara - tbsp - leaves,Khara bath | Masala rava bath - Swasthi's Recipes,"Khara bath is a basic south Indian breakfast recipe made with semolina, mix veggies & spices. It is a popular breakfast in the tiffin centers & restaurants."
url502,https://www.indianhealthyrecipes.com/kheer-recipes-payasam-recipes/,5.1,1106,1071,4.614,0.288,2015-04-24T08:10:35,2015-04-24T08:10:35,2019-08-20T11:17:06,20 - milk - varieties - rice - jaggery - great - recipe - season - sugar - payasam - using - 2019 - kheer - indian - festive,20 Payasam varieties for the festive season 2019 - Swasthi's Recipes,"Payasam varieties or kheer recipes. Indian milk puddings often made for festivals, celebrations and special days. Recipes with step by step photos"
url503,https://www.indianhealthyrecipes.com/khichdi-recipe-babies-moong-dal-khichdi/,6.2,1339,1319,5.323,0.34,2014-08-08T10:40:07,2014-08-08T10:40:07,2019-08-01T06:55:36,food - add - dal - toddlers - recipe - water - moong - khichdi - babies - baby - vegetable - vegetables - rice,khichdi recipe for babies toddlers | vegetable moong dal khichdi,"khichdi recipe for babies toddlers - 2 easy vegetable moong dal khichdi recipes for babies and toddlers, tastes delicious and easy to make, healthy as well"
url504,https://www.indianhealthyrecipes.com/khoya-gulab-jamun-recipe/,6.8,1469,1442,2.137,0.537,2017-10-14T07:40:31,2017-10-14T07:40:31,2019-05-21T23:16:21,oil - add - powder - dough - balls - gulab - sweets - hot - mawa - khoya - indian - syrup - jamun,Khoya gulab jamun recipe | Gulab jamun with khoya mawa | Indian sweets,"Khoya gulab jamun recipe with video & step by step photos - Soft, juicy and delicious gulab jamuns made with khoya or mawa"
url505,https://www.indianhealthyrecipes.com/kids-lunch-box-recipes-indian-vegetarian/,2.6,2397,550,6.789,0.288,2013-02-19T17:17:00,2013-02-19T17:17:00,2019-08-20T02:02:44,good - snack - 100 - sauce - lunch - soya - box - roti - recipes - rice - kids,Kids lunch box recipes | 100 Healthy Recipes for kids lunch & snack box,"Recipes for kids lunch box & snack - Over 100 vegetarian healthy kids lunch box recipes, includes south Indian & north Indian recipes rice, paratha, snacks"
url506,https://www.indianhealthyrecipes.com/kids-snacks-recipes-healthy-indian-kids-snack-recipes/,2.4,463,507,6.507,0.274,2013-06-02T07:30:00,2013-06-02T07:30:00,2019-08-25T07:49:56,quick - snack - egg - snacks - choose - school - healthy - recipes - indian - kids,Indian snacks for Kids | Healthy Indian snack recipes | Healthy snacks,Indian snacks for kids - a collection of over 80 easy & healthy Indian snacks recipes that are great for evening snack or kids snacks box too
url507,https://www.indianhealthyrecipes.com/kobbari-kudumulu-uppu-kudumulu-recipe/,2.8,655,597,6.249,0.499,2013-09-04T06:46:00,2013-09-04T06:46:00,2019-06-04T00:53:26,cup - add - kobbari - sweet - recipe - vinayaka - water - uppu - kudumulu - coconut - rice,Kobbari kudumulu | uppu kudumulu | vinayaka chavithi recipes,Kobbari kudumulu or uppu kudumulu are savory rice balls made for vinayaka chavithi prasadam in andhra pradesh. Recipw ith step by step photos
url508,https://www.indianhealthyrecipes.com/kodi-vepudu-chicken-vepudu-hot-and-spicy-guntur-chicken-fry/,3.4,738,715,6.992,0.534,2012-12-07T19:13:00,2012-12-07T19:13:00,2019-05-22T10:55:16,guntur - add - masala - powder - recipe - spicy - kodi - vepudu - chicken - tsp - g - fry - tbsp - till,Guntur chicken fry | Spicy guntur kodi vepudu | Guntur chicken vepudu,Guntur chicken fry is a hot and spicy guntur style chicken made with fresh ground masala. It is eaten as a side with rice- rasam or in a andhra meal
url509,https://www.indianhealthyrecipes.com/kolhapuri-chicken-recipe/,2.9,657,622,2.556,0.537,2017-05-14T15:35:52,2017-05-14T15:35:52,2019-05-21T23:20:19,poppy - powder - seeds - mg - saute - spicy - chicken - g - spices - kolhapuri - tbsp,Kolhapuri chicken | How to make spicy chicken kolhapuri recipe,"Kolhapuri chicken made with fresh ground kolhapuri masala. This delicious, hot and spicy dish is popular in the restaurants"
url510,https://www.indianhealthyrecipes.com/korma-masala-powder/,2.8,620,585,5.225,0.515,2014-09-13T16:29:40,2014-09-13T16:29:40,2019-05-29T01:30:12,poppy - add - masala - powder - seeds - dry - homemade - recipe - korma - spices - coconut - kurma,Korma masala powder recipe | Kurma masala powder recipe,No meta description found.
url511,https://www.indianhealthyrecipes.com/kova-ladoo-recipe/,3.4,774,729,2.178,0.504,2017-09-29T10:06:04,2017-09-29T10:06:04,2019-06-02T16:03:54,kova - kobbari - jaggery - mg - kajjikayalu - recipe - sugar - g - ladoo - mixture - coconut,Kova ladoo recipe | Kobbari kova kajjikayalu | Kova coconut ladoo recipe,Kova ladoo or kova kajjikaayalu are coconut stuffed sweets made with milk solids. These are very popular in andhra pradesh
url512,https://www.indianhealthyrecipes.com/kudumulu-undrallu-vinayaka-chavithi-prasadam-nivedyam/,6.8,1473,1447,5.277,0.258,2014-08-25T07:09:00,2014-08-25T07:09:00,2019-08-31T02:49:30,cup - undrallu - rava - recipe - vinayaka - chavithi - water - steam - minutes - kudumulu - prasadam - using - naivedyam - rice,Kudumulu | Undrallu recipe | Vinayaka chavithi recipes,Kudumulu or undrallu arw one of the most common vinayaka chavithi recipes prepared for prasadam or naivedyam. Steamed rice balls are offered to Lord Ganesha
url513,https://www.indianhealthyrecipes.com/kulfi-recipe/,4.7,1017,994,2.622,0.162,2017-04-20T10:10:34,2017-04-20T10:10:34,2019-10-05T10:50:01,add - powder - corn - recipe - boil - cream - malai - instant - used - moulds - milk - kulfi - stirring,Kulfi recipe - Swasthi's Recipes,"Kulfi recipe - malai kulfi is a popular Indian ice cream dessert made with thickened milk, sugar,kesar and pista. It tastes creamy & delicious"
url514,https://www.indianhealthyrecipes.com/ladies-finger-curry-recipe-north-indian-bhindi-ki-sabzi/,4.4,976,943,6.022,0.184,2013-11-26T01:29:00,2013-11-26T01:29:00,2019-09-27T01:56:23,tomatoes - ladies - curry - add - sabji - ki - bhindi - fry - sabzi - finger - rice,Bhindi ki sabji | How to make bhindi sabzi - Swasthi's Recipes,bhindi ki sabji - a north Indian ladies finger curry to have with roti or rice. Learn to make bhindi ki sabzi with step by step photos. Delicious and easy
url515,https://www.indianhealthyrecipes.com/lassi-recipe/,5.3,1151,1129,1.647,0.279,2018-04-11T10:40:23,2018-04-11T10:40:23,2019-08-23T01:49:40,salted - cup - curd - add - whisk - sweet - powder - lassi - recipe - water - sugar - yogurt - recipes - salt,Lassi recipe | How to make lassi - Swasthi's Recipes,Lassi is a classic yogurt drink from Indian subcontinent. Often relished with a meal or as a refreshing beverage. Sweet lassi and salted lassie ..
url516,https://www.indianhealthyrecipes.com/lauki-ka-halwa/,4.4,969,927,1.285,0.175,2018-08-21T14:47:23,2018-08-21T14:47:23,2019-09-30T05:46:34,dudhi - gourd - halwa - recipe - bottle - tbsp - sugar - cook - ghee - ka - lauki - milk,Lauki ka halwa recipe | Dudhi halwa | Bottle gourd halwa recipe,"Lauki ka halwa is a delicious Indian dessert made using bottle gourd, ghee, sugar and milk. It is great to serve as a after meal dessert."
url517,https://www.indianhealthyrecipes.com/lauki-paratha-recipe-bottle-gourd-paratha/,3.4,763,712,4.395,0.373,2015-07-13T14:27:34,2015-07-13T14:27:34,2019-07-20T03:33:20,paratha - gourd - rolling - mg - bottle - recipe - flour - methi - g - lauki - leaves,Lauki paratha recipe | How to make bottle gourd paratha | Doodhi paratha,No meta description found.
url518,https://www.indianhealthyrecipes.com/lemon-chicken-recipe/,3.9,859,820,4.54,0.027,2015-05-21T08:48:21,2015-05-21T08:48:21,2019-11-23T11:50:37,spice - easy - add - chinese - indo - ginger - lemon - starter - recipe - chili - tsp - chicken - fry - rice,Lemon chicken recipe | how to make lemon chicken recipe | chicken starter,"Lemon chicken recipe, a fusion chicken starter recipe that goes great as an appetizer, as a side to fried rice or hakka noodles or plain rice."
