URL_NUM,URL_NAME,NLP_READING_TIME_IN_MINS_212WPM,BSOUP_NUMWORDS,NLP_NUMWORDS,META_YEARS_SINCE_FIRST_PUBLISHED,META_YEARS_SINCE_LAST_MODIFIED,NLP_FIRST_PUBLISHED_DATETIME,META_FIRST_PUBLISHED_DATE,META_LAST_MODIFIED_DATETIME,NLP_KEYWORDS,TITLE_TAG_VALUE,META_DESCRIPTION
url231,https://www.indianhealthyrecipes.com/chicken-tikka-in-oven/,5.2,1127,1113,6.836,0.285,2013-02-02T09:06:00,2013-02-02T09:06:00,2019-08-21T02:26:01,marinade - oil - add - powder - mg - recipe - yogurt - chicken - g - tikka,Chicken tikka recipe - Swasthi's Recipes,Chicken tikka recipe - Learn to make the best grilled tandoori Indian chicken tikka in oven or grill from scratch with step by step instructions.
url232,https://www.indianhealthyrecipes.com/chicken-tikka-masala-recipe-sanjeev-kapoor/,6.1,1286,1291,7.227,0.537,2012-09-12T06:20:00,2012-09-12T06:20:00,2019-05-21T07:17:02,add - masala - gravy - tsp - flame - chicken - pan - tikka - fry - indian - till,Chicken tikka masala recipe | How to make Indian chicken tikka masala,Chicken tikka masala recipe - One of India's popular boneless chicken gravy recipe. Learn how to make chicken tikka masala with step by step photos
url233,https://www.indianhealthyrecipes.com/chickpea-soup/,2.7,611,581,6.271,0.214,2013-08-27T07:54:00,2013-08-27T07:54:00,2019-09-16T15:11:29,cup - add - mg - recipe - soup - water - tsp - g - chickpea - chickpeas,Chickpea soup recipe - Swasthi's Recipes,"Easy, delicious, protein rich and filling chickpea soup made with chickpeas, spices and herbs. Serve it with croutons or some cutlet."
url234,https://www.indianhealthyrecipes.com/chikki-recipe/,6.9,1494,1468,1.178,0.271,2018-09-29T16:52:12,2018-09-29T16:52:12,2019-08-26T09:04:35,cup - peanuts - stage - jaggery - recipe - peanut - ball - chikki - skin - consistency - syrup,Chikki recipe | How to make chikki | Peanut chikki - Swasthi's Recipes,Chikki recipe - Learn how to make peanut chikki at home using jaggery. Detailed tips and steps to make a perfect chikki that doesn't turn stringy or sticky.
url235,https://www.indianhealthyrecipes.com/chili-mushroom-indo-chinese-recipe/,3.1,697,664,7.0,0.096,2012-12-04T07:04:00,2012-12-04T07:04:00,2019-10-29T04:00:16,cup - mushroom - add - sauce - mushrooms - recipe - g - chilli - fried - tbsp,Chilli mushroom recipe | How to make chilli mushroom - Swasthi's Recipes,"Chilli mushroom recipe - a recipe without deep frying mushrooms. It tastes great, can be served as a appetizer with hakka noodles or fried rice"
url236,https://www.indianhealthyrecipes.com/chilli-chicken-dry-recipe-indo-chinese-style/,8.2,1740,1736,5.068,0.134,2014-11-09T07:08:00,2014-11-09T07:08:00,2019-10-15T05:06:23,oil - add - sauce - powder - recipe - tsp - red - chicken - chilli - hot,Chilli chicken recipe | How to make chilli chicken - Swasthi's Recipes,Chilli chicken is a popular Indo-chinese appetizer made by tossing fried chicken in spicy hot chilli sauce. Learn to make the best at home with this recipe.
url237,https://www.indianhealthyrecipes.com/chilli-garlic-noodles-chinese-noodles/,3.5,784,742,3.729,0.51,2016-03-12T16:32:36,2016-03-12T16:32:36,2019-05-31T10:59:13,garlic - easy - add - spring - oil - chinese - indo - saute - recipe - red - water - noodles - g - chilli,Chilli garlic noodles recipe | Easy Indo chinese noodles recipe,"Chilli garlic noodles recipe - A variation of the Indo chinese hakka noodles recipe with fresh garlic and red chilli flakes. Serve hot, you will love it."
url238,https://www.indianhealthyrecipes.com/chilli-paneer-recipe/,9.8,2043,2086,0.479,0.077,2019-06-11T05:14:25,2019-06-11T05:14:25,2019-11-05T11:13:23,paneer - add - dry - sauce - gravy - recipe - corn - water - flour - red - chilli - fried,Chilli paneer recipe | How to make chilli paneer dry & gravy,Chilli paneer recipe video - Learn how to make chilli paneer dry and gravy recipe like we get in Indo chinese restaurants. Recipe with step by step photos
url239,https://www.indianhealthyrecipes.com/chilli-potato-recipe/,6.6,1427,1399,4.189,0.285,2015-09-26T12:59:14,2015-09-26T12:59:14,2019-08-21T10:00:46,add - half - sauce - recipe - tbsp - potato - red - water - flour - chilli - potatoes - aloo,Chilli potato recipe | How to make chilli potato | Chilli aloo,Chilli potato is starter snack made of crisp fried potatoes tossed in sweet spicy & sour chilli sauce. Recipe with tips to make the best like in restaurants
url240,https://www.indianhealthyrecipes.com/chilli-prawns-recipe/,4.6,1001,974,2.868,0.279,2017-01-20T12:58:03,2017-01-20T12:58:03,2019-08-23T01:51:12,add - chilli - sauce - recipe - tbsps - tsp - flour - ½ - prawns - tbsp,Chilli prawns recipe - Swasthi's Recipes,No meta description found.
url241,https://www.indianhealthyrecipes.com/chocolate-banana-cake-recipe/,4.8,1063,1022,3.677,0.537,2016-03-31T15:33:20,2016-03-31T15:33:20,2019-05-21T06:28:20,cup - add - wheat - frosting - condensed - chocolate - cake - banana - recipe - choco - flour - water - milk,Chocolate banana cake recipe with choco condensed milk frosting,"Chocolate banana cake recipe with step by step photos. Delicious, soft, fluffy and light cake with choco condensed milk frosting."
url242,https://www.indianhealthyrecipes.com/chocolate-banana-freezer-fudge/,2.5,591,533,5.751,0.288,2014-03-05T11:41:00,2014-03-05T11:41:00,2019-08-20T02:30:01,freezer - mg - chocolate - banana - fudge - g - butter - ice - coconut - cream - treat,Chocolate Banana ice cream fudge | Chocolate banana freezer fudge,"Chocolate banana ice cream fudge. Rich, delicious and healthy chocolate treat made without cream. A summer treat for the kids & grown-ups alike."
url243,https://www.indianhealthyrecipes.com/chocolate-banana-ice-cream-popsicles/,3.5,775,737,5.671,0.274,2014-04-03T11:45:00,2014-04-03T11:45:00,2019-08-25T07:43:59,popsicles - bananas - chocolate - recipe - banana - sugar - freeze - smooth - ice - cream - till,chocolate banana ice cream | chocolate banana popsicles,chocolate banana ice cream recipe - learn to make easy and the best creamy chocolate banana ice cream with step by step photos.
url244,https://www.indianhealthyrecipes.com/chocolate-burfi-recipe-using-khoya-easy-diwali-sweets-recipes/,4.2,943,898,5.173,0.537,2014-10-02T07:59:00,2014-10-02T07:59:00,2019-05-21T03:56:10,add - powder - mins - barfi - chocolate - recipe - sugar - burfi - g - khoya - milk,chocolate burfi recipe | chocolate barfi recipe | burfi recipe,chocolate burfi recipe or chocolate barfi recipe - Learn to make the best delicious chocolate burfi that tastes like real chocolate and milk
url245,https://www.indianhealthyrecipes.com/chocolate-chip-cookies-recipe/,3.6,822,772,3.995,0.501,2015-12-06T16:27:29,2015-12-06T16:27:29,2019-06-03T02:40:53,cup - cookies - add - mix - mins - chocolate - recipe - sugar - flour - g - chip,Chocolate chip cookies recipe | How to make chocolate chip cookies recipe,No meta description found.
url246,https://www.indianhealthyrecipes.com/chocolate-chip-muffins-recipe-easy-muffins-recipe/,3.6,793,765,4.507,0.499,2015-06-02T14:45:52,2015-06-02T14:45:52,2019-06-04T02:08:12,cup - easy - add - mix - chocolate - recipe - muffins - sugar - flour - tsp - minutes - half - chip,chocolate chip muffins recipe | easy muffins recipe,"chocolate chip muffins recipe with step by step photos. These muffins taste delicious, fluffy and soft. The recipe is simple and quick one."
url247,https://www.indianhealthyrecipes.com/chocolate-coconut-cake-recipe-chocolate-cake-recipe-using-desiccated-coconut-butter-free/,3.2,707,677,5.956,0.501,2013-12-20T04:08:00,2013-12-20T04:08:00,2019-06-03T10:46:04,free - add - mins - mg - chocolate - desiccated - cake - recipe - sugar - flour - butter - g - using - coconut - milk,Chocolate coconut cake recipe using desiccated coconut (butter free),chocolate coconut cake with step by step pictures - recipe needs no butter yet tastes great with unique flavors of coconut and cocoa
url248,https://www.indianhealthyrecipes.com/chocolate-modak-recipe/,3.5,796,752,3.252,0.504,2016-09-02T06:15:35,2016-09-02T06:15:35,2019-06-02T15:36:48,modak - cocoa - mg - chocolate - recipe - sugar - mawa - g - mixture - begin,Chocolate modak recipe | How to make chocolate modak recipe,"Chocolate modak recipe - Delicious, rich modaks made with milk solids, sugar and cocoa. These will be a great treat to kids during Ganesh chaturthi"
url249,https://www.indianhealthyrecipes.com/chocolate-oats-recipe/,2.5,572,523,2.973,0.274,2016-12-13T12:57:09,2016-12-13T12:57:09,2019-08-25T07:40:37,add - mg - oatmeal - chocolate - oats - recipe - sugar - g - cook - milk,Chocolate oats recipe | How to make chocolate oatmeal recipe,"Chocolate oats recipe - Delicious, super quick & easy to make chocolate oatmeal dessert. This can be made vegan & made ahead."
url250,https://www.indianhealthyrecipes.com/chocolate-poke-cake/,6.4,1368,1355,0.592,0.468,2019-05-01T14:33:59,2019-05-01T14:33:59,2019-06-15T08:32:38,cup - poke - sauce - chocolate - cake - sugar - vanilla - cream - syrup - whipped,Chocolate poke cake | How to make poke cake - Swasthi's Recipes,No meta description found.
url251,https://www.indianhealthyrecipes.com/chocolate-sandesh/,4.9,1082,1048,5.178,0.334,2014-09-30T05:53:49,2014-09-30T05:53:49,2019-08-03T16:52:07,sandesh - paneer - add - cinnamon - chocolate - recipe - sugar - chenna - water - using - milk - kids,Chocolate sandesh | How to make chocolate sandesh for kids,chocolate sandesh recipe - a festive treat made with fresh homemade chenna and cocoa. Learn to make chocolate sandesh with step by step photos
url252,https://www.indianhealthyrecipes.com/chocolate-sandwich-how-to-make-chocolate-sandwich/,2.0,479,418,5.079,0.373,2014-11-05T14:31:36,2014-11-05T14:31:36,2019-07-20T03:52:30,sandwich - mg - cinnamon - meal - chocolate - recipe - g - slice - chips - nuts - syrup,Chocolate sandwich recipe | How to make chocolate sandwich recipe,chocolate sandwich recipe - This quick to make grilled chocolate sandwich can be made in minutes. One of the favorites among kids for their school box.
url253,https://www.indianhealthyrecipes.com/chocolate-shake-recipe/,2.8,653,595,2.611,0.537,2017-04-24T10:23:50,2017-04-24T10:23:50,2019-05-21T03:38:58,cocoa - powder - chocolate - recipe - sugar - milkshake - shake - ice - tbsp - cold - milk,Chocolate shake recipe | Chocolate milkshake recipe | Cold chocolate milk,Chocolate shake recipe - Learn to make chocolate milkshake with basic ingredients at home. This cold chocolate milk is healthy & is made without ice cream
url254,https://www.indianhealthyrecipes.com/chocolate-sponge-cake/,6.0,1280,1266,0.986,0.271,2018-12-08T16:19:20,2018-12-08T16:19:20,2019-08-26T02:06:05,sponge - inch - beat - egg - chocolate - cake - eggs - flour - used - ribbon,Chocolate sponge cake recipe | How to make chocolate sponge cake,No meta description found.
url255,https://www.indianhealthyrecipes.com/chole/,8.9,1865,1896,0.321,0.068,2019-08-08T08:13:00,2019-08-08T08:13:00,2019-11-08T02:59:00,add - masala - stovetop - powder - pressure - coriander - ginger - recipe - tea - water - pot - instant - chole - tsp,Chole recipe | How to make chole - Swasthi's Recipes,Chole recipe - Simple recipe to make delicious & flavorful punjabi chole at home. Instructions for stovetop & instant pot included
url256,https://www.indianhealthyrecipes.com/chum-chum-recipe-bengali-sweet/,6.4,1383,1360,7.066,0.54,2012-11-10T17:15:00,2012-11-10T17:15:00,2019-05-20T01:03:15,add - sweet - recipe - sugar - water - cham - chenna - mawa - chum - milk - syrup,Cham cham sweet recipe | Chum chum recipe | Sweet cham cham,Cham cham sweet recipe - A classic Bengali delicacy known as chom chom or chum chum is made during durga puja or diwali. Recipe with step by step pics
url257,https://www.indianhealthyrecipes.com/churumuri-recipe/,4.0,887,843,7.485,0.392,2012-06-10T00:04:00,2012-06-10T00:04:00,2019-07-13T10:28:33,tomatoes - churumuri - add - onions - powder - mg - recipe - g - spiced - puffed - salt - rice,Churumuri recipe | How to make churumuri | Spiced puffed rice recipe,"Churumuri recipe is a popular puffed rice snack from karnataka. It is also a street food made with puffed rice, onions, tomatoes,peanuts & spice powder."
url258,https://www.indianhealthyrecipes.com/chutney-egg-sandwich-recipe/,3.6,807,763,4.49,0.373,2015-06-08T07:00:25,2015-06-08T07:00:25,2019-07-20T03:52:23,easy - bread - sandwich - mg - egg - recipe - eggs - g - chutney - veggies - recipes,Chutney Egg Sandwich Recipe | Easy Egg sandwich recipes,Chutney egg sandwich recipe - a quick breakfast or snack can be made in just minutes if boiled eggs are ready. They are protein packed & healthy too
url259,https://www.indianhealthyrecipes.com/clear-soup/,5.6,1191,1187,0.427,0.055,2019-06-30T13:19:41,2019-06-30T13:19:41,2019-11-13T10:39:26,garlic - oil - add - mushrooms - ginger - recipe - stock - soup - step - veggies - clear,Clear soup recipe | How to make clear soup - Swasthi's Recipes,"Clear soup is healthy, delicious & simple to make with left over veggies in your fridge. Serve clear soup hot with some noodles or fried rice."
url260,https://www.indianhealthyrecipes.com/coconut-barfi-recipe/,2.7,614,569,3.085,0.51,2016-11-02T02:12:59,2016-11-02T02:12:59,2019-05-31T09:46:22,add - mg - barfi - recipe - heat - mawa - khoya - g - turns - coconut - milk,Coconut barfi recipe | How to coconut barfi with mawa or khoya,No meta description found.
url261,https://www.indianhealthyrecipes.com/coconut-burfi-recipe-coconut-barfi/,8.6,1810,1817,4.088,0.126,2015-11-02T12:44:25,2015-11-02T12:44:25,2019-10-18T16:03:16,milk - add - powder - cardamom - barfi - recipe - burfi - cook - mixture - turns - coconut - nariyal,Coconut burfi recipe | How to make coconut barfi | Nariyal barfi,"Coconut burfi recipe - One of the most commonly made barfi recipe during festivals like holi, diwali, navratri. It just takes less than 15 mins to make."
url262,https://www.indianhealthyrecipes.com/coconut-chutney-recipe-idli-dosa-chutney/,3.3,741,696,3.833,0.288,2016-02-03T16:11:18,2016-02-03T16:11:18,2019-08-20T10:28:47,add - dal - ingredients - fried - recipe - idli - dosa - g - chutney - gram - coconut,"Idli chutney recipe | How to make chutney for dosa, idli","Idli chutney recipe - This is a basic chutney for dosa, idli, pongal, vada. It can also be served with snacks & sandwiches"
url263,https://www.indianhealthyrecipes.com/coconut-fig-smoothie-recipe/,1.8,446,383,5.263,0.499,2014-08-30T14:56:42,2014-08-30T14:56:42,2019-06-04T02:36:01,tender - mg - fig - recipe - smoothie - water - fresh - g - figs - coconut,Coconut fig smoothie recipe | Tender coconut smoothie recipe,No meta description found.
url264,https://www.indianhealthyrecipes.com/coconut-laddu-kobbari-louz-recipe/,4.0,881,850,6.156,0.532,2013-10-08T03:17:00,2013-10-08T03:17:00,2019-05-23T07:04:29,add - kobbari - jaggery - mix - mg - recipe - louz - step - ladoo - pan - g - coconut,coconut ladoo recipe with jaggery | kobbari louz recipe,No meta description found.
url265,https://www.indianhealthyrecipes.com/coconut-ladoo-coconut-balls-recipe/,3.2,732,680,3.71,0.537,2016-03-19T06:14:46,2016-03-19T06:14:46,2019-05-21T12:44:58,add - sweet - condensed - cups - balls - desiccated - recipe - ½ - ladoo - milkmaid - coconut - milk,Coconut ladoo with condensed milk | Coconut balls recipe with milkmaid,Coconut ladoo with condensed milk and desiccated coconut. A quick ladoo recipe can be made anytime when you have friends home or on any occasions.
url266,https://www.indianhealthyrecipes.com/coconut-ladoo-recipe-coconut-laddu/,6.3,1371,1346,4.797,0.329,2015-02-16T16:13:19,2015-02-16T16:13:19,2019-08-05T13:11:08,milk - add - jaggery - powder - recipe - sugar - ladoo - mixture - ladoos - coconut - nariyal,Coconut ladoo recipe | How to make coconut ladoo (laddu) | Nariyal ladoo,"Coconut ladoo recipe or nariyal ladoo , a popular Indian festive delight made with milk, sugar and coconut. Learn to make easy coconut ladoo recipe"
url267,https://www.indianhealthyrecipes.com/coconut-milk-rice/,5.2,1127,1105,5.066,0.342,2014-11-10T06:52:00,2014-11-10T06:52:00,2019-07-31T04:07:11,cup - annam - add - kobbari - recipe - water - green - spices - fry - coconut - milk - rice,Coconut milk rice | How to make coconut milk rice | Kobbari annam,"Coconut milk rice also called as coconut rice, andhra kobbari annam is very delicious, mildly flavored and tastes great with any good simple curry"
url268,https://www.indianhealthyrecipes.com/coconut-oats-recipe/,3.4,767,731,1.397,0.449,2018-07-11T14:51:45,2018-07-11T14:51:45,2019-06-22T03:39:12,add - dal - style - south - rolled - oats - recipe - water - tsp - g - tbsp - coconut - indian,Coconut oats recipe | South Indian style coconut oats | Rolled oats recipe,"Coconut oats recipe is a very quick to make breakfast idea using rolled oats. It tastes delicious, is healthy and can be prepared just under 15 mins."
url269,https://www.indianhealthyrecipes.com/coconut-oreo-ice-cream-recipe/,2.7,618,581,5.515,0.54,2014-05-30T07:18:14,2014-05-30T07:18:14,2019-05-20T13:56:12,cookies - oreo - mg - sugar - g - used - ice - vanilla - coconut - cream,Oreo ice cream recipe | How to make Oreo ice cream,No meta description found.
url270,https://www.indianhealthyrecipes.com/coconut-recipes/,3.6,799,769,2.584,0.288,2017-05-04T15:07:15,2017-05-04T15:07:15,2019-08-20T07:10:46,easy - rice - dry - south - recipe - fresh - chutney - using - recipes - coconut - milk - 30 - indian,Coconut recipes | 30 Easy coconut recipes using fresh & dry coconut,"Coconut recipes - Collection of 30 delicious recipes using coconut in the fresh, dried or desicatted form. Recipes include sweets, curries, desserts, sides"
url271,https://www.indianhealthyrecipes.com/coconut-rice-recipe/,4.5,997,963,4.688,0.282,2015-03-28T04:40:05,2015-03-28T04:40:05,2019-08-22T10:12:57,curry - add - dal - thengai - recipe - g - cook - using - coconut - sadam - leaves - rice - grated,Coconut rice recipe | How to make coconut rice | Thengai sadam,Coconut rice is one of South Indian's favorite rice dishes made often for quick lunch or lunch box or festive meals. Thengai sadam or coconut rice ...
url272,https://www.indianhealthyrecipes.com/cold-coffee-recipe/,2.8,645,598,2.658,0.121,2017-04-07T03:46:30,2017-04-07T03:46:30,2019-10-20T14:11:11,add - coffee - cubes - recipe - sugar - water - g - shake - ice - cold - milk,Cold coffee recipe - Swasthi's Recipes,Cold coffee recipe - Learn to make cold coffee at home with these simple and basic ingredients. This is great to serve on a warm or hot day.
url273,https://www.indianhealthyrecipes.com/cook-basmati-rice-biryani/,6.1,1313,1284,3.145,0.512,2016-10-11T14:43:05,2016-10-11T14:43:05,2019-05-30T08:31:53,method - dum - add - basmati - biryani - meal - water - pot - cook - cooked - cooker - cooking - rice,How to cook basmati rice in pot or cooker for a meal or biryani,Learn to cook basmati rice in pot or cooker for a meal or biryani the right way. With the help of step by step photos you can make it perfect!
url274,https://www.indianhealthyrecipes.com/cooker-cake-recipe/,7.4,1565,1571,1.767,0.137,2018-02-26T11:01:23,2018-02-26T11:01:23,2019-10-14T02:34:12,bake - pressure - chocolate - recipe - cake - baking - hot - pan - cooker - salt,Cooker cake recipe | How to make cake in cooker - Swasthi's Recipes,Cooker cake recipe - Learn how to bake cake in cooker with video & step by step photos. This post shares a simple eggless cake in pressure cooker
url275,https://www.indianhealthyrecipes.com/copra-laddu-recipe/,3.6,816,766,1.614,0.501,2018-04-23T12:08:16,2018-04-23T12:08:16,2019-06-03T12:00:50,dried - add - kobbari - laddu - jaggery - dates - endu - recipe - g - ladoo - coconut - copra - kids,Copra laddu recipe | Endu kobbari laddu | Dried coconut jaggery ladoo,"Copra laddu recipe - Endu kobbari laddu are a quick, delicious and healthy sweet snack that can be made in just 10 minutes. These are sugar free & iron rich."
url276,https://www.indianhealthyrecipes.com/coriander-coconut-chutney/,9.7,2013,2062,4.677,0.296,2015-04-01T06:49:16,2015-04-01T06:49:16,2019-08-17T20:04:50,cup - chilies - varieties - add - dal - recipe - tsp - red - water - chutney - coconut,Coconut chutney | How to make coconut chutney - Swasthi's Recipes,"Coconut chutney is a south indian condiment made with fresh coconut, chilies, spices & herbs. Learn to make 7 easy coconut chutney varieties"
url277,https://www.indianhealthyrecipes.com/corn-chat-easy-healthy-corn-recipe-corn-salad/,2.6,592,543,6.326,0.537,2013-08-07T08:00:00,2013-08-07T08:00:00,2019-05-21T08:37:27,paneer - sweet - snack - chaat - mg - corn - recipe - water - g - using - recipes,Corn chaat recipe | Sweet corn chaat recipe | Sweet corn recipes,"Corn chaat is one of the easiest corn recipes. It an easy corn salad made using corn, fresh veggies, cheese and mild spice powders."
url278,https://www.indianhealthyrecipes.com/corn-cheese-sandwich-recipe/,3.0,678,639,4.792,0.373,2015-02-18T08:14:58,2015-02-18T08:14:58,2019-07-20T03:52:23,bread - cheese - sweet - slices - sandwich - corn - recipe - g - using - place,Corn cheese sandwich recipe | Sweet corn sandwich recipe,"Corn cheese sandwich recipe - Simple & easy sandwich made with sweet corn, cheese, fresh veggies and mild spice powders. Delicious !!"
url279,https://www.indianhealthyrecipes.com/corn-cream-cheese-sandwich-recipe/,3.2,723,668,3.241,0.373,2016-09-06T13:53:41,2016-09-06T13:53:41,2019-07-20T03:49:19,cheese - sweet - sandwich - mg - frozen - corn - recipe - g - using - grilled - cream,Corn cream cheese sandwich recipe | Grilled corn cheese sandwich recipe,"Corn cream cheese sandwich recipe - One of the kids favorite at home. These can be made for kids parties, I am sure most kids love cream cheese and corn."
url280,https://www.indianhealthyrecipes.com/corn-cutlet-recipe-corn-patties/,3.4,768,720,4.104,0.542,2015-10-27T14:37:00,2015-10-27T14:37:00,2019-05-19T07:44:55,bread - crumbs - sweet - dough - corn - recipe - patties - poha - cutlet - tbsp - potatoes,Corn cutlet recipe | Corn patties recipe | How to make sweet corn cutlet,"Corn cutlet recipe with step by step photos. Quick, easy and delicious evening snack that can be made in minutes. Serve with a chutney or a cup of tea"
url281,https://www.indianhealthyrecipes.com/corn-pakoda-recipe-pakora-recipe/,3.5,788,748,3.419,0.397,2016-07-03T10:57:09,2016-07-03T10:57:09,2019-07-11T14:19:12,masala - sweet - style - cob - corn - pakoda - andhra - spicy - tsp - flour - g - mixture - hot,Corn pakoda recipe | Andhra style spicy sweet corn pakoda,"Corn pakoda recipe - These sweet corn pakora are addictive, crunchy and delicious. They make a great monsoon snack and can be enjoyed with masala chai"
url282,https://www.indianhealthyrecipes.com/corn-pulao-recipe/,4.7,1029,1001,2.433,0.403,2017-06-28T10:16:09,2017-06-28T10:16:09,2019-07-09T05:20:13,video - add - sweet - mins - saute - corn - recipe - paste - water - pulao - chili - rice,Corn pulao recipe video | How to make sweet corn rice pulao recipe,"Corn pulao is a delicious dish made by cooking rice with spices, herbs and corn. This one pot dish is quick to make and tastes delicious."
url283,https://www.indianhealthyrecipes.com/cornflakes-chat-recipe/,2.2,503,457,4.973,0.521,2014-12-14T11:57:20,2014-12-14T11:57:20,2019-05-27T10:04:58,cumin - powder - chaat - mg - ingredients - cornflakes - recipe - tsp - g - chat - ghee - kids,cornflakes chat recipe | cornflakes recipe,"cornflakes chat recipe with step by step pictures, easy, yummy and low calorie cornflakes recipe in just 5 minutes."
url284,https://www.indianhealthyrecipes.com/crispy-corn-recipe/,6.3,1360,1333,1.181,0.214,2018-09-28T11:07:37,2018-09-28T11:07:37,2019-09-16T09:57:09,oil - sweet - kernels - frying - crispy - egg - corn - recipe - water - flour - tbsp - hot,Crispy corn recipe | Crispy sweet corn recipe - Swasthi's Recipes,Crispy corn is a spiced snack made by frying sweet corn kernels. It makes for a great party or tea time snack . Made with minimum ingredients ...
url285,https://www.indianhealthyrecipes.com/crispy-onion-pakoda-pakora-recipe/,7.4,1724,1559,5.09,0.282,2014-11-01T00:29:00,2014-11-01T00:29:00,2019-08-22T02:14:07,oil - add - onion - dough - frying - recipe - pakoda - flour - crisp - gram - hot - onions,"Onion pakoda recipe, how to make pakoda - Swasthi's Recipes",Onion pakoda - Learn to make the best crispy onion pakoda at home. These are so delicious & addictive that you will make them time & again
url286,https://www.indianhealthyrecipes.com/crunchy-cornflakes-peanut-ladoo-how-to-make-peanut-ladoo/,2.8,651,598,7.444,0.537,2012-06-25T06:17:00,2012-06-25T06:17:00,2019-05-21T02:33:27,peanuts - laddu - jaggery - powder - cornflakes - peanut - poha - recipe - g - ladoo - skin - recipes,Peanut ladoo recipe | how to make peanut laddu | ladoo recipes,"Peanut ladoo recipe - learn how to make crunchy peanut laddu, one of the most delicious and nutritious ladoo that i made for the kids snack box"
url287,https://www.indianhealthyrecipes.com/cucumber-curry-dosakaya-curry/,3.5,778,751,0.364,0.359,2019-07-23T11:17:19,2019-07-23T11:17:19,2019-07-25T01:11:57,tomatoes - curry - cucumber - add - rice - dal - style - mg - andhra - teaspoon - g - onions - dosakaya,Cucumber curry | Andhra style dosakaya curry - Swasthi's Recipes,"Easy cucumber curry made in andhra style. This dosakaya curry goes well with rice & roti, chapathi. It tastes very delicious and is light on the tummy."
url288,https://www.indianhealthyrecipes.com/cucumber-raita-recipe/,2.0,479,414,4.762,0.063,2015-03-01T10:28:49,2015-03-01T10:28:49,2019-11-10T10:42:54,cucumber - cumin - powder - juice - mg - ginger - recipe - raita - fresh - yogurt - g,"Cucumber raita recipe | How to make cucumber raita for biryani, pulao",Cucumber raita recipe- a yogurt based side. one of the quick & easy raita to accompany a biryani or pulao. Biryani meal is incomplete without a raita
