URL_NUM,URL_NAME,NLP_READING_TIME_IN_MINS_212WPM,BSOUP_NUMWORDS,NLP_NUMWORDS,META_YEARS_SINCE_FIRST_PUBLISHED,META_YEARS_SINCE_LAST_MODIFIED,NLP_FIRST_PUBLISHED_DATETIME,META_FIRST_PUBLISHED_DATE,META_LAST_MODIFIED_DATETIME,NLP_KEYWORDS,TITLE_TAG_VALUE,META_DESCRIPTION
url1,https://www.indianhealthyrecipes.com/,0.0,1931,0,0,0,None,Not found = first published time,Not found = last updated time,recipes - swasthis,Swasthi's Recipes - Indian food blog with easy Indian recipes,Indian food blog on healthy vegetarian and chicken recipes with step by step pictures for easy cooking
url2,https://www.indianhealthyrecipes.com/7-cups-burfi-recipe-besan/,6.9,1481,1464,4.082,0.192,2015-11-04T10:47:01,2015-11-04T10:47:01,2019-09-24T08:58:05,cup - add - sweet - powder - cups - cake - recipe - sugar - ½ - burfi - mixture - ghee,7 cup burfi recipe | 7 cup cake | 7 cups sweet - Swasthi's Recipes,"7 cup burfi recipe from South Indian Cuisine. How to make barfi recipe with besan, made during festivals like diwali, navratri ganesh chaturthi.Delicious!"
url3,https://www.indianhealthyrecipes.com/9-easy-vinayaka-chavithi-naivedhyam-recipes-andhra-recipes/,3.5,2114,744,5.274,0.252,2014-08-26T02:30:00,2014-08-26T02:30:00,2019-09-02T03:29:10,rice - jaggery - lord - chaturthi - vinayaka - chavithi - ganesh - recipes - 2019 - naivedyam - ganesha,Vinayaka chavithi recipes | Vinayaka chavithi naivedyam recipes 2019,Vinayaka chavithi recipes - Andhra style recipes to offer as naivedyam / prasadam for vinayaka chaturthi pooja. Recipes with stepwise photos
url4,https://www.indianhealthyrecipes.com/about/,3.0,648,643,0,0,None,Not found = first published time,Not found = last updated time,simple - blog - readers - cooking - food - share - swasthis - healthy - recipes - indian,ABOUT - Swasthi's Recipes,No meta description found.
url5,https://www.indianhealthyrecipes.com/achari-paneer-masala-recipe/,5.4,1161,1152,1.975,0.249,2017-12-12T00:22:59,2017-12-12T00:22:59,2019-09-03T10:14:13,paneer - add - curd - seeds - saute - heat - recipe - tsp - achari - pan,Achari paneer recipe | How to make achari paneer - Swasthi's Recipes,"Achari paneer masala is a hot, spicy and flavorful paneer curry made with pickling spices. This is a restaurant style recipe that is uniquely delicious"
url6,https://www.indianhealthyrecipes.com/adai-recipe-adai-dosa/,6.0,1289,1265,2.192,0.181,2017-09-24T06:36:34,2017-09-24T06:36:34,2019-09-28T16:08:49,add - dal - adai - batter - recipe - water - slightly - dosa - pan - thick - rice,Adai recipe | Adai dosa recipe | How to make adai recipe,Adai recipe - Adai is a kind of dosa from tamilnadu. It is high in protein hence makes a healthy breakfast for kids and grownups alike.
url7,https://www.indianhealthyrecipes.com/ajwain-paratha-recipe/,3.6,829,765,3.693,0.37,2016-03-25T03:12:39,2016-03-25T03:12:39,2019-07-21T10:29:06,paratha - tawa - seeds - sprinkle - carom - ajwain - recipe - roll - flour - soft - needed - cloth,Ajwain paratha recipe | How to make carom seeds paratha recipe,No meta description found.
url8,https://www.indianhealthyrecipes.com/akki-roti-recipe-akki-rotti/,8.6,1831,1816,4.249,0.381,2015-09-04T07:20:35,2015-09-04T07:20:35,2019-07-17T09:20:14,spread - dough - akki - tawa - banana - water - flour - roti - rice - cloth,Akki roti recipe | How to make akki roti - Swasthi's Recipes,"Akki roti recipe - rice flour roti made in karnataka style, accompanied with any simple chutney tastes delicious. Akki rotti are a simple tiffin food..."
url9,https://www.indianhealthyrecipes.com/alasanda-vada-recipe-lobia-vada-baked-and-fried-recipes/,3.3,759,703,7.222,0.51,2012-09-14T07:30:00,2012-09-14T07:30:00,2019-05-31T10:54:24,fritters - deep - alasandalu - mins - mg - recipe - lobia - water - pea - g - eyed - vada - alasanda - black,Alasanda vada recipe | Lobia vada | Black eyed pea fritters,Alasanda vada or black eyed pea fritters are very popular in Andhra pradesh during festivals. They taste great with a simple coconut chutney
url10,https://www.indianhealthyrecipes.com/alasandalu-kura-bobbarlu-curry-recipe/,2.6,589,545,6.638,0.501,2013-04-15T07:13:00,2013-04-15T07:13:00,2019-06-03T00:09:53,curry - alasandalu - mg - recipe - lobia - tsp - used - g - till - paste - bobbarlu,Alasandalu curry | Bobbarlu curry | Lobia curry recipe,Bobbaralu curry is one of our favorites. It is also called as alasandalu curry or lobia curry. Learn to use bobbaralu the most delicious and easy way
url11,https://www.indianhealthyrecipes.com/allam-pachadi/,4.7,1036,1000,7.238,0.378,2012-09-08T16:39:00,2012-09-08T16:39:00,2019-07-18T14:32:13,allam - tamarind - add - style - blend - ginger - taste - recipe - pickle - andhra - red - pachadi - till,Allam pachadi | Ginger pickle recipe | How to make ginger pickle recipe,"allam pachadi is andhra ginger pickle recipe that is made during winters to accompany idli, dosa, pesarattu or rice. Learn to make allam pachadi"
url12,https://www.indianhealthyrecipes.com/almond-burfi-using-coconut-palm-sugar-or-jaggery/,3.5,795,745,5.775,0.507,2014-02-24T10:14:00,2014-02-24T10:14:00,2019-06-01T03:06:18,badam - jaggery - powder - barfi - recipe - almond - sugar - burfi - almonds - using - palm - syrup,Almond burfi recipe with jaggery | Badam barfi recipe with jaggery,No meta description found.
url13,https://www.indianhealthyrecipes.com/almond-carrot-smoothie-almond-smoothie-recipe/,1.7,429,353,7.595,0.367,2012-05-01T13:31:00,2012-05-01T13:31:00,2019-07-22T06:57:02,cup - mg - almond - recipe - smoothie - sugar - g - summer - using - milk - carrot,Almond Carrot Smoothie recipe - Swasthi's Recipes,No meta description found.
url14,https://www.indianhealthyrecipes.com/almond-milk-for-babies-and-kids-indian-recipe/,6.2,1345,1321,5.068,0.101,2014-11-09T08:57:00,2014-11-09T08:57:00,2019-10-27T13:29:11,badam - helps - recipe - doodh - sugar - almonds - smooth - saffron - milk - paste - kids,Badam milk recipe | How to make badam milk - Swasthi's Recipes,"Badam milk recipe - Indian badam milk is a healthy, nutritious & delicious drink suitable not only to toddlers & kids but also to grown ups."
url15,https://www.indianhealthyrecipes.com/almond-yogurt-recipe/,3.2,733,673,6.803,0.504,2013-02-14T18:34:00,2013-02-14T18:34:00,2019-06-02T01:10:27,warm - mg - vegan - almond - starter - recipe - almonds - yogurt - g - milk,almond yogurt recipe - how to make almond yogurt at home,"almond yogurt recipe - learn to make almond yogurt at home with step by step photos. Absolutely delicious, smooth, nutritious and healthy"
url16,https://www.indianhealthyrecipes.com/aloo-baingan-masala-recipe/,4.4,964,937,3.611,0.066,2016-04-24T08:14:14,2016-04-24T08:14:14,2019-11-09T06:22:52,brinjal - add - masala - baingan - recipe - medium - potato - water - onions - potatoes - aloo - paste,Aloo baingan masala recipe | Aloo baingan recipe | Potato brinjal recipe,"Aloo baingan masala curry - A simple aloo baingan recipe that pairs great with rice, roti or paratha. This potato brinjal recipe is a favorite at home"
url17,https://www.indianhealthyrecipes.com/aloo-bonda-recipe-how-to-make-potato-bonda/,4.7,1019,995,7.523,0.392,2012-05-27T05:45:00,2012-05-27T05:45:00,2019-07-13T10:40:26,oil - add - powder - batter - bonda - recipe - tsp - fry - aloo - hot - turmeric,Aloo bonda recipe - Swasthi's Recipes,Aloo bonda recipe also called as potato bonda is popular in south Indian states & is often served as a snack with a cup of tea. Potato stuffed bonda recipe
url18,https://www.indianhealthyrecipes.com/aloo-chaat-recipe/,5.6,1210,1184,2.008,0.126,2017-11-30T05:44:22,2017-11-30T05:44:22,2019-10-18T07:26:49,add - deep - sweet - chaat - powder - recipe - potato - green - chutney - fried - potatoes - aloo,Aloo chaat recipe | How to make aloo chaat | Potato chaat recipe,"Aloo chaat recipe - Simple, home style and healthy aloo chaat made without frying. This is quick to make for a evening snack or when you have friends home"
url19,https://www.indianhealthyrecipes.com/aloo-gobi-recipe/,6.9,1487,1469,3.584,0.038,2016-05-04T01:56:16,2016-05-04T01:56:16,2019-11-19T14:03:54,tomatoes - add - gobi - coriander - recipe - tsp - cauliflower - cook - fry - potatoes - aloo,Aloo gobi recipe | How to make aloo gobi - Swasthi's Recipes,"Aloo gobi recipe - Restaurant style aloo gobi masala that tastes delicious & is flavor packed. Serve it with rice, roti or paratha"
url20,https://www.indianhealthyrecipes.com/aloo-grilled-sandwich-recipe/,2.6,607,558,3.351,0.373,2016-07-28T15:37:18,2016-07-28T15:37:18,2019-07-20T03:49:26,bread - add - sandwich - mg - recipe - potato - tsp - green - g - potatoes - aloo,Aloo sandwich recipe | Potato sandwich recipe | Aloo bread sandwich,Aloo sandwich recipe - Learn how to make aloo masala sandwich at home. A quick breakfast recipe under 25 minutes to make on busy days
url21,https://www.indianhealthyrecipes.com/aloo-matar-recipe-aloo-mutter-recipe/,5.0,1094,1065,2.718,0.156,2017-03-16T14:51:58,2017-03-16T14:51:58,2019-10-07T04:26:55,add - matar - saute - recipe - water - mutter - onions - potatoes - aloo - rice - peas,Aloo matar recipe | Aloo mutter - Swasthi's Recipes,"Aloo matar is a simple dish made by simmering potatoes & peas in a spicy onion tomato gravy. Serve it with rice, roti, poori , paratha or even with naan."
url22,https://www.indianhealthyrecipes.com/aloo-methi-paratha/,3.4,765,721,7.381,0.37,2012-07-18T14:08:00,2012-07-18T14:08:00,2019-07-21T10:29:49,oil - paratha - dough - tsp - water - flour - methi - soft - aloo - till,Aloo methi paratha recipe | How to make aloo methi paratha,Aloo methi paratha is one of the healthy paratha i make for quick lunch or dinner. Served with just curd or chutney they taste great and delicious
url23,https://www.indianhealthyrecipes.com/aloo-methi-recipe-dry-aloo-methi/,3.9,856,821,7.014,0.068,2012-11-29T06:33:00,2012-11-29T06:33:00,2019-11-08T03:28:46,add - recipe - water - methi - g - roti - fry - potatoes - aloo - leaves - rice,Aloo methi | How to make aloo methi - Swasthi's Recipes,Aloo methi recipe with step by step photos. Aloo & methi are a great delicious combo and when cooked together they don't even taste bitter.
url24,https://www.indianhealthyrecipes.com/aloo-pakora-recipe-potato-bajji/,3.0,692,637,3.441,0.529,2016-06-25T14:11:10,2016-06-25T14:11:10,2019-05-24T07:54:18,oil - add - pakora - batter - bajji - recipe - potato - water - tsp - g - potatoes - aloo - hot,Aloo pakora recipe | Aloo bajji recipe | Potato bajji recipe,"Aloo pakora, potato bajji or aloo bajji are a quick potato snack made to enjoy with chai. Learn to make crispy aloo bajji at home."
url25,https://www.indianhealthyrecipes.com/aloo-palak-recipe-quick-and-easy/,7.2,1515,1534,1.521,0.263,2018-05-27T13:17:00,2018-05-27T13:17:00,2019-08-29T06:33:02,spinach - add - chopped - recipe - potato - water - palak - teaspoon - cook - sabzi - aloo - indian - potatoes,Aloo palak recipe | Aloo palak sabzi | Spinach potatoes recipe,"Aloo palak is a simple, healthy & delicious dish of spinach, potatoes & spices. It can be served with rice, roti, paratha or puri."
url26,https://www.indianhealthyrecipes.com/aloo-patta-gobhi-sabzi/,3.5,783,738,3.233,0.521,2016-09-09T13:51:20,2016-09-09T13:51:20,2019-05-27T23:18:20,stir - add - gobhi - patta - saute - recipe - potato - water - cook - fry - sabzi - cabbage - aloo,Aloo patta gobhi sabzi recipe | Potato cabbage stir fry recipe,"Aloo patta gobhi sabzi recipe - simple, healthy stir fry made with cabbage and potatoes. This goes great with rice or chapathi, can be packed in box."
url27,https://www.indianhealthyrecipes.com/aloo-tikka-recipe-tandoori-potatoes/,3.9,880,836,3.397,0.507,2016-07-11T06:10:08,2016-07-11T06:10:08,2019-06-01T01:05:37,add - grilled - skewers - grill - recipe - tsp - tikka - tandoori - potatoes - aloo,Aloo tikka recipe | Tandoori aloo tikka | Tandoori potatoes,Aloo tikka recipe - Tandoori potatoes made with spiced yogurt and other ingredients. One of the popular restaurant style veg starters made with baby potatoes
url28,https://www.indianhealthyrecipes.com/aloo-tikki-recipe/,4.2,938,888,2.551,0.123,2017-05-16T08:26:27,2017-05-16T08:26:27,2019-10-19T08:05:41,bread - alu - add - crumbs - crispy - recipe - flour - tikki - fry - potatoes - aloo - hot,Aloo tikki recipe | How to make aloo tikki | Crispy alu tikki recipe,Aloo tikki recipe - These crisp delicious aloo tikki can be served as a snack with some mint chutney and masala chai. You can also serve with chaat topping
url29,https://www.indianhealthyrecipes.com/ambur-biryani/,4.7,1025,991,2.816,0.288,2017-02-08T14:47:37,2017-02-08T14:47:37,2019-08-20T02:42:48,video - biryani - star - ambur - tamilnadu - recipe - water - chicken - cook - used - tbsp - rice,Ambur biryani | Ambur star biryani | Tamilnadu biryani,Ambur biryani recipe with video - One of the well known south Indian biryani variety is Ambur star biryani from a small town in Vellore district
url30,https://www.indianhealthyrecipes.com/amla-juice-with-manuka-honey-indian-gooseberry/,3.0,692,633,7.167,0.279,2012-10-04T03:17:00,2012-10-04T03:17:00,2019-08-23T07:45:41,c - juice - high - manuka - vitamin - recipe - natural - honey - water - amla,Amla juice recipe | How to make amla juice (Gooseberry juice),"Amla juice recipe - A detailed post on how to make amla juice for health benefits. It is an ayurvedic drink that can boost immunity, keep infections at bay"
url31,https://www.indianhealthyrecipes.com/amla-pickle-recipe/,3.4,778,727,2.956,0.534,2016-12-19T05:01:50,2016-12-19T05:01:50,2019-05-22T10:40:40,oil - add - avakaya - usiri - dry - powder - lemon - pickle - salt - jar - amla - rice,Amla pickle recipe | How to make amla pickle | Usiri avakaya,"Amla pickle recipe - andhra style amla pickle recipe known as usiri avakaya. This pickle stays great with plain rice, paratha or evn with dosa. upma"
url32,https://www.indianhealthyrecipes.com/amla-rice-usirikaya-pulihora/,3.0,669,637,7.027,0.504,2012-11-24T06:22:00,2012-11-24T06:22:00,2019-06-02T03:59:18,add - seeds - mg - recipe - pulihora - methi - g - step - usirikaya - recipes - amla - rice - mustard,amla rice | usirikaya pulihora | amla recipes,"amla rice also called as usirikaya pulihora is one of the easiest ways to consume amla. During the season, i make amla juice and amla thokku as well."
url33,https://www.indianhealthyrecipes.com/amla-thokku-usirikaya-pachadi-recipe/,2.4,533,500,7.153,0.51,2012-10-09T10:40:00,2012-10-09T10:40:00,2019-05-31T14:58:07,gooseberry - dal - seeds - sesame - recipe - tsp - red - g - chutney - usirikaya - pachadi - amla,Usirikaya pachadi | Amla chutney | Gooseberry chutney,"Usirikaya pachadi is andhra style amla chutney and is made often at home during the amla season. This pachadi goes well with rice, dosa and chapathi"
url34,https://www.indianhealthyrecipes.com/amritsari-tawa-fish-fry-pan-fried-amritsari-fish/,3.1,692,658,5.91,0.529,2014-01-06T07:24:00,2014-01-06T07:24:00,2019-05-24T03:12:00,oil - tawa - mins - mg - recipe - amritsari - tsp - fish - fry - besan - till,Amritsari fish recipe | Tawa fish fry recipe | Fish fry recipe,"Amritsari fish recipe- make a tawa fish fry or deep fry fish. recipe with step by step photos. serve it as a starter or as a side, yummy!"
url35,https://www.indianhealthyrecipes.com/andhra-amla-pickle-recipe/,9.5,1991,2006,1.882,0.515,2018-01-15T04:28:35,2018-01-15T04:28:35,2019-05-29T01:47:49,nilava - garlic - tamarind - oil - add - dry - pickle - andhra - water - salt - usirikaya - pachadi - amla - turn,Andhra amla pickle recipe | Nilava usirikaya pachadi recipe,No meta description found.
url36,https://www.indianhealthyrecipes.com/andhra-chicken-biryani-recipe-step-by-step-pictures/,4.4,937,927,5.066,0.537,2014-11-10T01:36:00,2014-11-10T01:36:00,2019-05-21T03:20:39,quick - add - masala - biryani - powder - andhra - water - yogurt - chicken - pot - cook - using - fry - till - rice,Andhra chicken biryani recipe | Quick chicken biryani in pot using yogurt,No meta description found.
url37,https://www.indianhealthyrecipes.com/andhra-chicken-curry-recipe-kodi-kura-with-step-by-step-pictures/,5.5,1173,1169,5.553,0.208,2014-05-16T02:45:00,2014-05-16T02:45:00,2019-09-18T14:33:32,curry - poppy - add - powder - seeds - recipe - andhra - water - chicken - till - paste,Andhra chicken curry recipe - Swasthi's Recipes,"Andhra chicken curry recipe - easy to make simple, delicious hot,spicy gravy. Learn andhra style chicken curry recipe with step by step photos"
url38,https://www.indianhealthyrecipes.com/andhra-chicken-iguru-how-to-make-andhra-chicken-iguru-step-by-step-pics/,3.1,701,665,6.732,0.537,2013-03-12T07:01:00,2013-03-12T07:01:00,2019-05-21T01:53:41,curry - iguru - semi - gravy - recipe - andhra - tsp - kodi - chicken - kura - g - thick - till,andhra chicken iguru | kodi kura iguru recipe,"chicken iguru also called kodi kura iguru, is one of the great tasting chicken curry with tasty thick semi gravy, step wise photos with recipe"
url39,https://www.indianhealthyrecipes.com/andhra-chili-chicken-recipe-spicy-and-hot-restaurant-style-chicken-starter/,3.6,782,756,5.296,0.279,2014-08-18T00:46:00,2014-08-18T00:46:00,2019-08-23T01:55:23,chilies - mg - recipe - andhra - starter - tsp - green - chicken - g - chilli - leaves,Andhra chilli chicken recipe - Swasthi's Recipes,No meta description found.
url40,https://www.indianhealthyrecipes.com/andhra-fish-fry-ghee-roasted-fish/,4.5,976,950,5.219,0.288,2014-09-15T01:36:00,2014-09-15T01:36:00,2019-08-20T10:43:41,curry - oil - masala - powder - recipe - andhra - chili - fish - pan - ghee - fry,Andhra fish fry recipe - Swasthi's Recipes,"Fish fry recipe to make delicious, healthy fish. Step by step photos to make the best tasting south Indian style fish fry to serve as starter or with rice"
url41,https://www.indianhealthyrecipes.com/andhra-pesarattu-whole-moong-dosa/,5.7,1246,1210,5.063,0.288,2014-11-11T00:44:00,2014-11-11T00:44:00,2019-08-20T02:03:45,little - dal - batter - pesarattu - ginger - recipe - water - moong - dosa - green - gram - rice,Pesarattu recipe | How to make pesarattu dosa - Swasthi's Recipes,"Pesarattu recipe or moong dal dosa, Learn to make the best thin and crispy andhra pesarattu with step by step photos, best protein filled breakfast"
url42,https://www.indianhealthyrecipes.com/andhra-sambar-recipe-how-to-make-south-indian-sambar/,14.2,2969,3011,7.362,0.2,2012-07-25T08:31:00,2012-07-25T08:31:00,2019-09-21T07:40:14,tamarind - add - dal - powder - taste - recipe - sambar - sambhar - veggies - vegetables,Sambar recipe | How to make sambar recipe - Swasthi's Recipes,"Sambar recipe - Learn how to make south indian sambar that tastes delicious & is very flavorful. Serve it with rice, idli, vada, pongal"
url43,https://www.indianhealthyrecipes.com/andhra-special-crispy-punugulu-punukkulu-urad-dal-bonda/,5.2,1126,1096,5.066,0.392,2014-11-10T01:01:00,2014-11-10T01:01:00,2019-07-13T10:23:14,add - dal - batter - runny - idli - recipe - dosa - punugulu - consistency - rice,Punugulu recipe | How to make punugulu with idli dosa batter | Punukulu,Punugulu recipe - Learn to make crispy andhra punugulu with step by step photos. They can be made with idli dosa batter or fresh batter or even maida
url44,https://www.indianhealthyrecipes.com/andhra-tomato-pickle-nilava-tomato-pachadi/,5.2,1124,1095,5.526,0.301,2014-05-26T02:57:00,2014-05-26T02:57:00,2019-08-15T03:00:32,tomatoes - tamarind - add - powder - seeds - tomato - recipe - pickle - fenugreek - till - mustard,Tomato pickle - Swasthi's Recipes,"Tomato pickle recipe made with ripe tomatoes, spices, curry leaves & oil. Store this in a air tight glass jar & use with in 3 months."
url45,https://www.indianhealthyrecipes.com/anjeer-barfi/,3.5,776,739,5.126,0.537,2014-10-19T04:24:43,2014-10-19T04:24:43,2019-05-21T03:47:12,free - chopped - dry - dates - barfi - recipe - anjeer - sugar - used - figs - cook - recipes - nuts,Anjeer barfi recipe | How to make anjeer barfi (sugar free barfi recipe),"Anjeer barfi or burfi recipe with step by step photos. Healthy, delicious and sugar free figs and nuts barfi made for special occasions and celebrations at home."
url46,https://www.indianhealthyrecipes.com/antina-unde/,5.6,1216,1197,0.847,0.288,2019-01-28T06:13:51,2019-01-28T06:13:51,2019-08-20T01:56:14,dried - gum - antina - add - jaggery - dates - recipe - unde - antu - ghee - tbsp,Antina unde | Karnataka style protein rich edible gum balls,No meta description found.
url47,https://www.indianhealthyrecipes.com/apple-juice-recipe/,4.1,931,876,2.677,0.288,2017-03-31T12:53:37,2017-03-31T12:53:37,2019-08-20T06:54:35,juicer - juice - blender - juicing - recipe - slow - apples - apple - making - skin,Apple juice recipe | How to make apple juice with & without a juicer,Apple juice recipe - learn how to make apple juice at home with a blender or a juicer. Low acid apples are best to juice in combination with other fruits.
url48,https://www.indianhealthyrecipes.com/apple-milkshake-recipe/,2.9,661,608,4.507,0.551,2015-06-02T04:51:00,2015-06-02T04:51:00,2019-05-16T15:24:38,shake - fruits - mg - recipe - apples - almonds - milkshake - g - using - apple - milk,Apple milkshake recipe | How to make apple milkshake | Milkshake recipes,"Apple milkshake recipe - learn to make a delicious, healthy apple shake, one of the most loved by kids.Good to enjoy this for breakfast or after school"
url49,https://www.indianhealthyrecipes.com/apple-oats-porridge-babies/,3.4,766,718,4.616,0.321,2015-04-23T11:01:03,2015-04-23T11:01:03,2019-08-08T08:49:16,food - add - powder - porridge - recipe - oats - making - babies - baby - apple - recipes - using,Apple oats porridge for babies | oats baby food recipes,"apple oats porridge for babies - Learn to make quick and easy oats baby food. Oats are one of the least allergenic foods, so this can be a baby's first food"
url50,https://www.indianhealthyrecipes.com/apple-orange-smoothie/,2.5,586,525,4.912,0.214,2015-01-05T06:06:19,2015-01-05T06:06:19,2019-09-16T15:27:40,orange - juice - pear - oranges - mg - vitamin - smoothie - apples - g - apple,Apple orange smoothie recipe - Swasthi's Recipes,apple orange smoothie is one of the best smoothie recipes on this blog. This works great as a immunity and appetite booster for my kids
url51,https://www.indianhealthyrecipes.com/apple-ragi-halwa-recipe-babies/,4.8,1056,1014,4.526,0.521,2015-05-26T02:10:55,2015-05-26T02:10:55,2019-05-27T23:24:56,ragi - toddlers - halwa - porridge - water - babies - flour - puree - apple - tbsp - quantity - kids,"Apple ragi halwa | Apple ragi porridge for babies, toddlers, kids","Apple ragi halwa is delicious, healthy & will be loved by all who loves the flavor of apple or the taste of ragi. It can be eaten by all including babies."
url52,https://www.indianhealthyrecipes.com/apple-rice-recipe-babies-toddlers/,3.9,886,826,4.153,0.523,2015-10-09T14:11:05,2015-10-09T14:11:05,2019-05-26T04:46:19,soak - toddlers - mg - pressure - porridge - recipe - water - babies - baby - apple - using - rice,Apple rice recipe for babies & toddlers | Apple rice porridge,Apple rice recipe or apple porridge suitable for babies and toddlers. One of the best to serve during cold and cough as it is light to digest and soothing
url53,https://www.indianhealthyrecipes.com/apple-tea-recipe-apple-cinnamon-tea-best-winter-tea-recipe/,3.3,743,695,6.033,0.537,2013-11-22T04:50:00,2013-11-22T04:50:00,2019-05-21T02:08:53,add - cinnamon - ingredients - winter - recipe - ginger - apples - tea - sugar - apple - pepper - best,apple tea recipe – apple cinnamon tea (best winter tea recipe),"apple tea recipe - Learn to make healthy apple tea, one of the best winter tea recipe i have loved and made it for years during my stay in bangalore."
url54,https://www.indianhealthyrecipes.com/aratikaya-bajji-recipe-raw-banana-bajji/,4.5,987,963,5.479,0.288,2014-06-12T09:48:16,2014-06-12T09:48:16,2019-08-20T09:07:29,raw - add - batter - bajji - banana - water - chili - green - aratikaya - salt - paste,Banana bajji | Aratikaya bajji recipe - Swasthi's Recipes,"Banana bajji or aratikaya bajji recipe is andhra style fried snack made with plaintain, spices, gram flour. These are a popular street food"
url55,https://www.indianhealthyrecipes.com/aratikaya-masala-kura-raw-banana-masala/,2.8,649,600,3.819,0.282,2016-02-08T06:02:14,2016-02-08T06:02:14,2019-08-22T04:25:18,tomatoes - curry - raw - masala - mg - banana - tsp - water - g - cook,Raw banana masala curry - Swasthi's Recipes,"Raw banana masala curry recipe - Delicious, spicy and healthy raw banana recipe made in south Indian style to serve with rice or chapathi."
url56,https://www.indianhealthyrecipes.com/aratikaya-vepudu-raw-plantain-fry/,2.3,560,493,5.556,0.537,2014-05-15T04:00:00,2014-05-15T04:00:00,2019-05-21T02:36:53,raw - mg - recipe - banana - tsp - vepudu - aratikaya - fry - till - pieces,Aratikaya vepudu | Aratikaya fry | Raw banana fry recipe,Aratikaya fry or aratikaya vepudu is a raw banana fry recipe made simple to accompany rice. Learn to make spicy and hot andhra style aratikaya fry
url57,https://www.indianhealthyrecipes.com/atta-ladoo-recipe-wheat-flour-laddu/,4.0,885,856,4.09,0.263,2015-11-01T13:31:39,2015-11-01T13:31:39,2019-08-29T15:20:47,laddu - powder - jaggery - recipe - atta - flour - ladoo - mixture - ghee - nuts - ladoos - wheat,Atta ladoo recipe | Wheat flour laddu - Swasthi's Recipes,"Atta ladoo are delicious sweet balls made with whole wheat flour, sweetener and ghee. These are a traditional winter snack .."
url58,https://www.indianhealthyrecipes.com/avakaya/,8.1,1755,1726,3.732,0.378,2016-03-11T09:40:29,2016-03-11T09:40:29,2019-07-18T09:29:52,preserve - mango - cup - oil - add - avakaya - large - dry - recipe - pickle - mangoes - pieces,Avakaya Recipe - Andhra Avakaya pachadi - Swasthi's Recipes,Avakaya recipe - I am sharing the method we andhra people make this spicy avakaya pachadi at home to preserve for an year.
